Question (deprecated),Question (summary),Question (description - optional),Contributors,Context layer,Question Type (deprecated),Question Type,Resource Type(s),Nested Questions,Parent Question,Notes
Was there initial analyses on this dataset before publication? Describe.,What kinds of  analyses were conducted prior to the dataset's publication?,This describes any analyses that were conducted prior to the dataset's publication. Analyses conducted by others post-publication do not need to be described.,Katy McKinney-Bock,Methodology Cycle > Data Preprocessing,Yes/No — short,Short Description,,,,"This doesn't fit in ""collection"", ""preprocessing"", or ""validation"". We don't have an ""analysis"" bubble - do we need this? "
"Was the dataset transformed or normalized? ","If the data were transformed or normalized, how was this done?",,Katy McKinney-Bock,Methodology Cycle > Data Preprocessing,Yes/No — short,Short Description,,,"%F0%9F%97%82%20V1%20Foundational%20Schema%20(Source%20of%20Truth)%20913368daa73f4a2aab9b46b6587675cd/What%20steps%20were%20taken%20to%20preprocess,%20clean%20and%20org%20ec638843075340e080e9b827ce6eafb5.md",
Was the data aggregated?,"If the data were aggregated, how was this done?",,Katy McKinney-Bock,Methodology Cycle > Data Preprocessing,Yes/No — short,Short Description,,,"%F0%9F%97%82%20V1%20Foundational%20Schema%20(Source%20of%20Truth)%20913368daa73f4a2aab9b46b6587675cd/What%20steps%20were%20taken%20to%20preprocess,%20clean%20and%20org%20ec638843075340e080e9b827ce6eafb5.md",
Was the data smoothed or denoised?,"If the data were smoothed or denoised, how was this done?",,Katy McKinney-Bock,Methodology Cycle > Data Preprocessing,Yes/No — short,Short Description,,,"%F0%9F%97%82%20V1%20Foundational%20Schema%20(Source%20of%20Truth)%20913368daa73f4a2aab9b46b6587675cd/What%20steps%20were%20taken%20to%20preprocess,%20clean%20and%20org%20ec638843075340e080e9b827ce6eafb5.md",
Was the data anonymized? Describe.,"If the data were anonymized, how was this done?",,Katy McKinney-Bock,Methodology Cycle > Data Preprocessing,Yes/No — short,Short Description,,,"%F0%9F%97%82%20V1%20Foundational%20Schema%20(Source%20of%20Truth)%20913368daa73f4a2aab9b46b6587675cd/What%20steps%20were%20taken%20to%20preprocess,%20clean%20and%20org%20ec638843075340e080e9b827ce6eafb5.md",
How were outliers identified?,How were outliers identified?,,Katy McKinney-Bock,Methodology Cycle > Data Preprocessing,Short Answer,Short Description,,,"%F0%9F%97%82%20V1%20Foundational%20Schema%20(Source%20of%20Truth)%20913368daa73f4a2aab9b46b6587675cd/What%20steps%20were%20taken%20to%20preprocess,%20clean%20and%20org%20ec638843075340e080e9b827ce6eafb5.md",
Were outliers excluded?,Were outliers excluded?,,Katy McKinney-Bock,Methodology Cycle > Data Preprocessing,Yes/No — short,Yes/No,,,"%F0%9F%97%82%20V1%20Foundational%20Schema%20(Source%20of%20Truth)%20913368daa73f4a2aab9b46b6587675cd/What%20steps%20were%20taken%20to%20preprocess,%20clean%20and%20org%20ec638843075340e080e9b827ce6eafb5.md",
Is there missing data?,What data are missing?,,Katy McKinney-Bock,Methodology Cycle > Data Preprocessing,Yes/No — short,Short Description,,,"%F0%9F%97%82%20V1%20Foundational%20Schema%20(Source%20of%20Truth)%20913368daa73f4a2aab9b46b6587675cd/What%20steps%20were%20taken%20to%20preprocess,%20clean%20and%20org%20ec638843075340e080e9b827ce6eafb5.md",
"What processes were in place to validate data before publication? ","What processes were in place to validate data before publication? ",A list and brief description of all of the processes in place to validate the data before publication.,"Katy McKinney-Bock, Riya Swayampati",Methodology Cycle > Data Validation,Long Answer,Long Description,,"%F0%9F%97%82%20V1%20Foundational%20Schema%20(Source%20of%20Truth)%20913368daa73f4a2aab9b46b6587675cd/How%20was%20file%20structure%20and%20format%20validated%20b2ffaf18d3a3422ab4224e4f4d59a343.md, %F0%9F%97%82%20V1%20Foundational%20Schema%20(Source%20of%20Truth)%20913368daa73f4a2aab9b46b6587675cd/How%20were%20data%20records%20validated%202c44717ff3f34a61841c4cc245ee2c90.md, %F0%9F%97%82%20V1%20Foundational%20Schema%20(Source%20of%20Truth)%20913368daa73f4a2aab9b46b6587675cd/How%20was%20consistency%20between%20datasets%20consisting%20of%200615f10376f445958f52bd8d673bf3a2.md, %F0%9F%97%82%20V1%20Foundational%20Schema%20(Source%20of%20Truth)%20913368daa73f4a2aab9b46b6587675cd/How%20was%20the%20dataset%20validated%20for%20consistency%20with%202d38157b17e74020b48e7b9ab6cae1af.md, %F0%9F%97%82%20V1%20Foundational%20Schema%20(Source%20of%20Truth)%20913368daa73f4a2aab9b46b6587675cd/How%20were%20data%20records%20identified%20for%20review%20bda1f87e6d244b96a4fcff87d9a37333.md, %F0%9F%97%82%20V1%20Foundational%20Schema%20(Source%20of%20Truth)%20913368daa73f4a2aab9b46b6587675cd/What%20types%20of%20validation%20were%20implemented%20d707230da7bf43168b18f70a3e8e8cc4.md",,
What types of validation were implemented?,What types of validation were implemented?,A brief description of the types of validation that were implemented on the data,"Katy McKinney-Bock, Riya Swayampati",Methodology Cycle > Data Validation,Short Answer,Short Description,,,%F0%9F%97%82%20V1%20Foundational%20Schema%20(Source%20of%20Truth)%20913368daa73f4a2aab9b46b6587675cd/What%20processes%20were%20in%20place%20to%20validate%20data%20befo%2026b19372f8a5474a9db510e51d8b32b3.md,"This reference was useful for developing nested questions:
https://ec.europa.eu/eurostat/cros/system/files/methodology_for_data_validation_v1.0_rev-2016-06_final.pdf. Essnet Validat Foundation."
How were data records identified for review?,How were data records identified for review?,,Katy McKinney-Bock,Methodology Cycle > Data Validation,Short Answer,Short Description,,,%F0%9F%97%82%20V1%20Foundational%20Schema%20(Source%20of%20Truth)%20913368daa73f4a2aab9b46b6587675cd/What%20processes%20were%20in%20place%20to%20validate%20data%20befo%2026b19372f8a5474a9db510e51d8b32b3.md,"This reference was useful for developing nested questions:
https://ec.europa.eu/eurostat/cros/system/files/methodology_for_data_validation_v1.0_rev-2016-06_final.pdf. Essnet Validat Foundation."
How was file structure and format validated?,How was file structure and format validated?,,Katy McKinney-Bock,Methodology Cycle > Data Validation,Short Answer,Short Description,,,%F0%9F%97%82%20V1%20Foundational%20Schema%20(Source%20of%20Truth)%20913368daa73f4a2aab9b46b6587675cd/What%20processes%20were%20in%20place%20to%20validate%20data%20befo%2026b19372f8a5474a9db510e51d8b32b3.md,"This reference was useful for developing nested questions:
https://ec.europa.eu/eurostat/cros/system/files/methodology_for_data_validation_v1.0_rev-2016-06_final.pdf. Essnet Validat Foundation."
How were data records validated?,How were data records validated?,,Katy McKinney-Bock,Methodology Cycle > Data Validation,Short Answer,Short Description,,,%F0%9F%97%82%20V1%20Foundational%20Schema%20(Source%20of%20Truth)%20913368daa73f4a2aab9b46b6587675cd/What%20processes%20were%20in%20place%20to%20validate%20data%20befo%2026b19372f8a5474a9db510e51d8b32b3.md,"This reference was useful for developing nested questions:
https://ec.europa.eu/eurostat/cros/system/files/methodology_for_data_validation_v1.0_rev-2016-06_final.pdf. Essnet Validat Foundation."
How was consistency between datasets consisting of multiple files for a given dataset validated?,How was consistency between datasets consisting of multiple files for a given dataset validated?,,Katy McKinney-Bock,Methodology Cycle > Data Validation,Short Answer,Short Description,,,%F0%9F%97%82%20V1%20Foundational%20Schema%20(Source%20of%20Truth)%20913368daa73f4a2aab9b46b6587675cd/What%20processes%20were%20in%20place%20to%20validate%20data%20befo%2026b19372f8a5474a9db510e51d8b32b3.md,"This reference was useful for developing nested questions:
https://ec.europa.eu/eurostat/cros/system/files/methodology_for_data_validation_v1.0_rev-2016-06_final.pdf. Essnet Validat Foundation."
"How was the dataset validated for consistency with other datasets of the same ""kind"" from other/external sources?","How was the dataset validated for consistency with other datasets of the same ""kind"" from other/external sources?",,Katy McKinney-Bock,Methodology Cycle > Data Validation,Short Answer,Short Description,,,%F0%9F%97%82%20V1%20Foundational%20Schema%20(Source%20of%20Truth)%20913368daa73f4a2aab9b46b6587675cd/What%20processes%20were%20in%20place%20to%20validate%20data%20befo%2026b19372f8a5474a9db510e51d8b32b3.md,"This reference was useful for developing nested questions:
https://ec.europa.eu/eurostat/cros/system/files/methodology_for_data_validation_v1.0_rev-2016-06_final.pdf. Essnet Validat Foundation."
What quality assurance (QA) indicators or processes were implemented?,What quality assurance (QA) indicators or processes were implemented?,A list of all the indicators or processes implemented during quality assurance along with a brief description for each one,"Katy McKinney-Bock, Riya Swayampati",Methodology Cycle > Data Validation,Long Answer,Short Description (List),,,,"Note: data validation questions need more work for V1.

What parts of quality assurance planning are important to document in the data lifecycle, and which for governance?"
"What quality control (QC) processes and software testing were implemented? ","What quality control (QC) processes and software testing were implemented? ",A list of all the processes and software testing implemented during quality control along with a brief description for each one,"Katy McKinney-Bock, Riya Swayampati",Methodology Cycle > Data Validation,Long Answer,Short Description (List),,,,
"Has the data validation been documented by the creators of the dataset? ","Has the data validation been documented by the creators of the dataset? ","This is a yes/no question regarding the existence of data validation documentation by the creators of the dataset. If yes, there is a nested question to attach the documentation. ","Katy McKinney-Bock, Riya Swayampati",Methodology Cycle > Data Validation,Yes/No — short,Yes/No,,%F0%9F%97%82%20V1%20Foundational%20Schema%20(Source%20of%20Truth)%20913368daa73f4a2aab9b46b6587675cd/Please%20provide%20the%20documentation%20a37c245df8fb43768659b674ecb4a890.md,,
" Please provide the documentation.",What is the available documentation associated with the data validation of the dataset?,All the available documentation or a link to the documentation associated with the data validation process to be attached to this question,Riya Swayampati,Methodology Cycle > Data Validation,,Resource (List),,,%F0%9F%97%82%20V1%20Foundational%20Schema%20(Source%20of%20Truth)%20913368daa73f4a2aab9b46b6587675cd/Has%20the%20data%20validation%20been%20documented%20by%20the%20cre%20274a4305bdbc4c0ba9221539c23a0d94.md,"reword to sound better than ""what"" - Riya"
Are there known data quality issues?,Are there any known data quality issues with the dataset?,,Katy McKinney-Bock,Methodology Cycle > Data Validation,Yes/No — short,Yes/No,,"%F0%9F%97%82%20V1%20Foundational%20Schema%20(Source%20of%20Truth)%20913368daa73f4a2aab9b46b6587675cd/What%20data%20quality%20issues%20were%20repaired%2044bcea35efa94311bd7107610805c151.md, %F0%9F%97%82%20V1%20Foundational%20Schema%20(Source%20of%20Truth)%20913368daa73f4a2aab9b46b6587675cd/What%20data%20quality%20issues%20persist%20b16c0931c043488ca559f34bfdb83c42.md, %F0%9F%97%82%20V1%20Foundational%20Schema%20(Source%20of%20Truth)%20913368daa73f4a2aab9b46b6587675cd/What%20are%20the%20known%20data%20quality%20issues%20e0b8fb9c94574e8881f3bb98795a76f0.md",,"Ported this question, but I think it needs a little more work on specificity."
What are the known data quality issues?,"What are the known data quality issues? ","A list of all the known data quality issues along with a brief description detailing what they are, and how they affected the dataset",Riya Swayampati,Methodology Cycle > Data Validation,,Short Description (List),,,%F0%9F%97%82%20V1%20Foundational%20Schema%20(Source%20of%20Truth)%20913368daa73f4a2aab9b46b6587675cd/Are%20there%20known%20data%20quality%20issues%20e0e2bf0e52cb40daac8b9dc63840c594.md,
What data quality issues were repaired?,What data quality issues were repaired?,A list of the issues that were repaired from the known data quality issues and a brief description of how.,"Katy McKinney-Bock, Riya Swayampati",Methodology Cycle > Data Validation,Short Answer,Short Description (List),,,%F0%9F%97%82%20V1%20Foundational%20Schema%20(Source%20of%20Truth)%20913368daa73f4a2aab9b46b6587675cd/Are%20there%20known%20data%20quality%20issues%20e0e2bf0e52cb40daac8b9dc63840c594.md,
What data quality issues persist?,What data quality issues persist?,A list of the issues that remain in the dataset from the list of known data quality issues a well as a brief description of why they persist.,"Katy McKinney-Bock, Riya Swayampati",Methodology Cycle > Data Validation,Short Answer,Short Description (List),,,%F0%9F%97%82%20V1%20Foundational%20Schema%20(Source%20of%20Truth)%20913368daa73f4a2aab9b46b6587675cd/Are%20there%20known%20data%20quality%20issues%20e0e2bf0e52cb40daac8b9dc63840c594.md,
Were validation methods automated or manual?,Were the validation methods automated or manual?,"Select the most appropriate option (automated, manual or both) for the question. There is a possibility that  there might be multiple validation methods which could be a combination of automated and manual methods. It is important to document this, which is why there is an option to select multiple choices","Katy McKinney-Bock, Riya Swayampati",Methodology Cycle > Data Validation,Short Answer,Select (List),,,,@Katy McKinney-Bock Please let me know if the description for this seems out of place or wrong @Riya Swayampati - I'll put an answer in the comments
"Was any collected information excluded from the published dataset?  ","Was any collected information excluded from the published dataset?  ","A yes/no question for any information (eg, variables, observations, etc) that was collected but not included in the published dataset. If yes, follow up with brief description of the excluded information in the nested question","Katy McKinney-Bock, Riya Swayampati",Methodology Cycle > Data Preservation,,Yes/No,,,,
Please describe.,What information is missing from the published dataset?,"A brief description of the excluded information and the reason it was excluded ",Riya Swayampati,Methodology Cycle > Data Preservation,,Short Description (List),,,,
What are the steps taken to remove or delete data?,What are the steps taken to remove or delete data?,A list of steps taken to remove or delete data,Katy McKinney-Bock,Methodology Cycle > Data Preservation,,Short Description (List),,,,Inspired by/included in Deon: https://deon.drivendata.org/examples/
What processes are in place for human subjects/participants/other people to request removal of data?,What processes are in place for people (participants and non-participants) to request removal of data?,"A description of the available processes for people to request removal of data. Since the processes might be different for different types of people, for eg human subjects, participants, and other people - provide descriptions for all groups available","Katy McKinney-Bock, Riya Swayampati",Methodology Cycle > Data Preservation,,Long Description,,,,Inspired by/included in Deon: https://deon.drivendata.org/examples/
When is the dataset considered archival or no longer in use?,When is the dataset considered archival or no longer in use?,,Katy McKinney-Bock,Methodology Cycle > Data Preservation,,Short Description,,%F0%9F%97%82%20V1%20Foundational%20Schema%20(Source%20of%20Truth)%20913368daa73f4a2aab9b46b6587675cd/Is%20this%20dataset%20part%20of%20an%20active%20project%20or%20progr%20bb602dfe40f7401bb5535adcfd82a9b4.md,,Inspired by/included in Deon: https://deon.drivendata.org/examples/
Is this dataset part of an active project or program?,Is this dataset part of an active project or program?,,Katy McKinney-Bock,Methodology Cycle > Data Preservation,,Yes/No,,,%F0%9F%97%82%20V1%20Foundational%20Schema%20(Source%20of%20Truth)%20913368daa73f4a2aab9b46b6587675cd/When%20is%20the%20dataset%20considered%20archival%20or%20no%20long%2036b38ad52c1e40ea9e414be275038e99.md,
"Document any errors, corrections, and omissions made to the dataset at any stage of the data lifecycle.","Were any errors, omissions, or other corrections made to the dataset?","Select options: [errors, omissions, other corrections, none]",Katy McKinney-Bock,Data Preservation > Corrections,,Select (List),,"%F0%9F%97%82%20V1%20Foundational%20Schema%20(Source%20of%20Truth)%20913368daa73f4a2aab9b46b6587675cd/Untitled%20c02f3f19f3c645af9e784539e7535d65.md, %F0%9F%97%82%20V1%20Foundational%20Schema%20(Source%20of%20Truth)%20913368daa73f4a2aab9b46b6587675cd/Untitled%209e86eff3339c4ee1a26480f3dd69399f.md, %F0%9F%97%82%20V1%20Foundational%20Schema%20(Source%20of%20Truth)%20913368daa73f4a2aab9b46b6587675cd/Untitled%204ed0a9f135fb4819bcea15c56ade84f4.md",,This is a draft; too general at present
,"What errors were found, and what corrections were made?","A description of any errors that were found in the dataset at any point in the data lifecycle, and whether the error was corrected, including details of steps taken.",Katy McKinney-Bock,Data Preservation > Corrections,,Short Description (List),,,"%F0%9F%97%82%20V1%20Foundational%20Schema%20(Source%20of%20Truth)%20913368daa73f4a2aab9b46b6587675cd/Document%20any%20errors,%20corrections,%20and%20omissions%20ma%20305215bad6b741c990b8644b8b20a00d.md",
What preservation/maintenance processes are in place for this dataset from creation to present?,What preservation/maintenance processes are in place for this dataset?,A description of data preservation and maintenance processes that are in place for the dataset throughout the data lifecycle.,Katy McKinney-Bock,Methodology Cycle > Data Preservation,,Long Description,,,,"todo: this question is very general; it could be more structured in future versions.

All of the ""maintenance"" questions are drafts; this section is still underdeveloped/not yet as comprehensive as it should be."
"What processes are in place to change file format or naming conventions? ","What processes are in place to change file format or naming conventions? ","A description of what processes are in place to change file format or naming conventions, and how data is preserved under these processes.",Katy McKinney-Bock,Data Preservation > Software/Hardware Maintenance,,Short Description (List),,,,"All of the ""maintenance"" questions are drafts; this section is still underdeveloped/not yet as comprehensive as it should be."
Are there version-controlled digital assets?,Are there version-controlled digital assets?,"An external link to version-controlled digital assets, if public, which shows a history of major versions of the assets. Alternately, a file may be provided that describes a history or description of major versions of digital assets",Katy McKinney-Bock,Data Preservation > Software/Hardware Maintenance,,Resource,"External Link, File",,,"All of the ""maintenance"" questions are drafts; this section is still underdeveloped/not yet as comprehensive as it should be."
Is there version-controlled digital documentation?,Is there version-controlled digital documentation?,"An external link to version-controlled digital documentation, which shows a history of major versions of the documentation for the dataset. Alternately, a file may be provided with current documentation, that describes a history or description of major versions.",Katy McKinney-Bock,Data Preservation > Software/Hardware Maintenance,,Resource,"External Link, File",,,"All of the ""maintenance"" questions are drafts; this section is still underdeveloped/not yet as comprehensive as it should be."
"How has hardware and data storage changed over time? ","How has hardware and data storage changed over time? ","A list containing basic information about how data storage has changed over time. A resource may be provided in the description, if available.",Katy McKinney-Bock,Data Preservation > Software/Hardware Maintenance,,Short Description (List),,,,"All of the ""maintenance"" questions are drafts; this section is still underdeveloped/not yet as comprehensive as it should be."
"Did people collect and/or annotate the data in order to implement machine learning? Describe the relationship between human subjects and machine learning models throughout the Data Lifecycle, as applicable (or if a similar human labor + automated relationship exists around data collection, preprocessing, validation, or analysis). ",Did people collect and/or annotate the data?,,Katy McKinney-Bock,Humans/Machines in the Loop > Humans/Labor,,Yes/No,,%F0%9F%97%82%20V1%20Foundational%20Schema%20(Source%20of%20Truth)%20913368daa73f4a2aab9b46b6587675cd/Untitled%208edbceae17b143559fc21651f3f4a67e.md,,
" Have humans examined any analysis or models (e.g. with error analysis) to understand what information and generalization was captured? "," Have humans examined any analysis or models to understand what information and/or generalization was captured? ",,Katy McKinney-Bock,Humans/Machines in the Loop > Humans/Labor,,Yes/No,,%F0%9F%97%82%20V1%20Foundational%20Schema%20(Source%20of%20Truth)%20913368daa73f4a2aab9b46b6587675cd/Untitled%2001bfd37d20d64d989fed3bed59c06ae9.md,,This could be in Data Validation as well.
"Provide links to available source code, software requirements, parameterization, and documentation for full reproducibility across the data lifecycle (GitHub, BitBucket, etc.). ",What external documentation is available for reproducibility?,"Provide links to available source code, software requirements, parameterization, and documentation for full reproducibility across the data lifecycle (GitHub, BitBucket, etc.). ",Katy McKinney-Bock,Humans/Machines in the Loop > Reproducibility Requirements,Long Answer,Resource (List),"External Link, File",,,
"What are the necessary conditions for replicating data collection, preprocessing, analysis, and validation? ","What are the necessary conditions for replicating data collection, preprocessing, analysis, and validation? ","A description of the information, processes, and resources that are needed for replicability of the data in its full lifecycle, including collection of new data, preprocessing, validation, and analysis.",Katy McKinney-Bock,Humans/Machines in the Loop > Reproducibility Requirements,Long Answer,Long Description,,%F0%9F%97%82%20V1%20Foundational%20Schema%20(Source%20of%20Truth)%20913368daa73f4a2aab9b46b6587675cd/Untitled%20b10abe9c5c004d87b07d792d513a5775.md,,
"What are the necessary conditions for reproducing data preprocessing, analysis, and validation? ","What are the necessary conditions for reproducing data preprocessing, analysis, and validation? ","A description of the processes and resources that would be needed for reproducibility of preprocessing, validation, and analysis, using the same dataset.",Katy McKinney-Bock,Humans/Machines in the Loop > Reproducibility Requirements,Long Answer,Long Description,,%F0%9F%97%82%20V1%20Foundational%20Schema%20(Source%20of%20Truth)%20913368daa73f4a2aab9b46b6587675cd/What%20information%20is%20missing%20that%20would%20be%20needed%20t%206855df5613fa4882bfeb052fbc9c39a3.md,,
"What information is missing that would be needed to reproduce the data lifecycle? To replicate the data lifecycle? ","What information is missing that would be needed to reproduce the data lifecycle? ","A description of information that is missing or not available, and that would be necessary for reproducibility.",Katy McKinney-Bock,Humans/Machines in the Loop > Reproducibility Requirements,Long Answer,Short Description (List),,,%F0%9F%97%82%20V1%20Foundational%20Schema%20(Source%20of%20Truth)%20913368daa73f4a2aab9b46b6587675cd/What%20are%20the%20necessary%20conditions%20for%20reproducing%20%20b5b2553658ee410c81dddd5ff01d070b.md,"This may be transformational, but I'm certain there are some ways to identify what is missing from foundational information → then take it into transformational discussion about why this is problematic. "
What is the full dataset name?,What is the full dataset name?,,Katy McKinney-Bock,Data Lifecycle,Short Answer,Short Description,,,,
"If yes, which data protection standard applies to this dataset?",Which data protection standard applies to this dataset?,A list of all recognized standards (if yes to parent question).,Riya Swayampati,Governance > Data Compliance > Data Protection,,Resource (List),,,%F0%9F%97%82%20V1%20Foundational%20Schema%20(Source%20of%20Truth)%20913368daa73f4a2aab9b46b6587675cd/Is%20there%20a%20data%20protection%20standard%20that%20this%20data%204bfc1a999dc643e8a54d304ba35672f0.md,
What non-data steward roles are associated with the dataset within the organization?,What non-data steward roles are associated with the dataset within the organization?,"A list of people who work closely with the dataset in the organization and a brief description of their roles. ",Riya Swayampati,Governance > Decision-Makers > Org Roles,Long Answer,Short Description (List),,,,
Who is typically allowed access to this dataset within the owning organization?,Who is typically allowed access to this dataset within the owning organization?,A list of people that are allowed access to this dataset within the owning organization,"Riya Swayampati, Shreyasha Paudel",Governance > Access,Short Answer,Person (List),,,,
Who are the intended users of this dataset?,Who are the intended users of this dataset?,A list and brief description of the characteristic of intended users for their dataset.,"Riya Swayampati, Shreyasha Paudel",Governance > Data Use,Long Answer,Short Description,,,,
