Question (deprecated),Question (summary),Question (description - optional),Contributors,Context layer,Question Type (deprecated),Question Type,Resource Type(s),Nested Questions,Parent Question,Notes
What are example use cases of this dataset?,What are example use cases of this dataset?,"This questions asks for some ways the dataset is being used. Note: This is an example of an actual use case, and not an imaginary.","Riya Swayampati, Shreyasha Paudel",Governance > Data Use,Long Answer,Short Description (List),,,,
Who is the point of contact for stewardship (data steward) of this dataset?,Who is the point of contact for stewardship (data steward) of this dataset?,This question asks for a point of contact or data steward for the dataset.,"Riya Swayampati, Shreyasha Paudel",Governance > Decision-Makers > Stewardship,Short Answer,Person,,%F0%9F%97%82%20V1%20Foundational%20Schema%20(Source%20of%20Truth)%20913368daa73f4a2aab9b46b6587675cd/Is%20the%20data%20steward%20the%20person%20in%20charge%20of%20the%20da%20375e2828141b46adace36dc276667a86.md,,
Is the data steward the person in charge of the dataset?,Is the data steward the person in charge of the dataset?,This question intends to clarify the role of data steward and whether they are involved in decision-making and/or maintenance of the dataset.,"Riya Swayampati, Shreyasha Paudel",Governance > Decision-Makers > Stewardship,Yes/No — short,Person,,"%F0%9F%97%82%20V1%20Foundational%20Schema%20(Source%20of%20Truth)%20913368daa73f4a2aab9b46b6587675cd/If%20not,%20who%20is%20in%20charge%20of%20making%20the%20final%20decis%20705ee4bed9ff4031b63f9c89640b3c02.md",%F0%9F%97%82%20V1%20Foundational%20Schema%20(Source%20of%20Truth)%20913368daa73f4a2aab9b46b6587675cd/Who%20is%20the%20point%20of%20contact%20for%20stewardship%20(data%20%203d0ecd606ba04e5889b581b292acdc5d.md,
"If not, who is  in charge of making the final decision if there is a ""grey area"" or confusion regarding the data?","Who is in charge of making the final decision if there is a ""grey area"" or confusion regarding the data?",This question intends to find the key person/s responsible for making decisions with regards to the dataset. An ideal context information would have an individual and their role within the organization as answer.,"Riya Swayampati, Shreyasha Paudel",Governance > Decision-Makers > Stewardship,Short Answer,Person,,,%F0%9F%97%82%20V1%20Foundational%20Schema%20(Source%20of%20Truth)%20913368daa73f4a2aab9b46b6587675cd/Is%20the%20data%20steward%20the%20person%20in%20charge%20of%20the%20da%20375e2828141b46adace36dc276667a86.md,
Is there an entity that makes discretionary decisions regarding the dataset?,Is there an entity that makes discretionary decisions regarding the dataset?,"This question is asking for a team or person within the organization who makes discretionary decisions regarding the dataset. This should include a list, if decision-makers are different at different stages of data lifecycle.","Riya Swayampati, Shreyasha Paudel",Governance > Decision-Makers,Yes/No — long,Person (List),,,,
Please include list of decision makers involved with dataset,Who are the decision makers involved with the dataset?,"This question is asking for people in addition to the team within the organization who makes discretionary decisions regarding the dataset. This should include a list, if decision-makers are different at different stages of data lifecycle.","Riya Swayampati, Shreyasha Paudel",Governance > Decision-Makers,Long Answer,Person (List),,,,
Is there a process for internal security assessment?,"What is the process for internal security assessment if it exists? ",This describes any security assessment policies that might apply for the dataset.  The information can point to existing document and/or a brief summary of the policies.,Shreyasha Paudel,Governance > Data Compliance > Security Protocols,Yes/No — short,Short Description (List),,%F0%9F%97%82%20V1%20Foundational%20Schema%20(Source%20of%20Truth)%20913368daa73f4a2aab9b46b6587675cd/When%20was%20the%20last%20security%20assessment%20748b33d5a4374be3b0db82347e1de64c.md,,
When was the last security assessment?,When was the last security assessment?,This question asks for the date of last security assessment. This information can be used to quantify the frequency of security assessments.,Shreyasha Paudel,Governance > Data Compliance > Security Protocols,Short Answer,Short Description,,,%F0%9F%97%82%20V1%20Foundational%20Schema%20(Source%20of%20Truth)%20913368daa73f4a2aab9b46b6587675cd/Is%20there%20a%20process%20for%20internal%20security%20assessmen%20f407eca8437343589e67a1ff7009802a.md,
Are there security protocols that are followed for this dataset,"What are the security protocols, if any, that are followed for this dataset?",This describes any protocols related to data security. The information can point to existing document and/or a brief summary of the protocol.,Shreyasha Paudel,Governance > Data Compliance > Security Protocols,Yes/No — short,Short Description,,,,
Does the dataset have an audit trail or record of other digital activities?,Does the dataset have an audit trail or record of other digital activities?,This is a yes/no question to determine whether the dataset has been audited.,Shreyasha Paudel,Governance > Data Compliance > Audit Trail,Yes/No — short,Yes/No,,"%F0%9F%97%82%20V1%20Foundational%20Schema%20(Source%20of%20Truth)%20913368daa73f4a2aab9b46b6587675cd/What%20are%20the%20items%20included%20in%20audit%20trail%20a70ad7f7dbdb425cb5cd5e6f3265ba53.md, %F0%9F%97%82%20V1%20Foundational%20Schema%20(Source%20of%20Truth)%20913368daa73f4a2aab9b46b6587675cd/Please%20describe%20the%20logical%20and%20procedural%20control%203d52f90640e446e184dc3f9690e4a12d.md, %F0%9F%97%82%20V1%20Foundational%20Schema%20(Source%20of%20Truth)%20913368daa73f4a2aab9b46b6587675cd/Please%20describe%20the%20policies%20available%20for%20reviewi%2048c0fb219c5f414f94c5bfef35da8ced.md, %F0%9F%97%82%20V1%20Foundational%20Schema%20(Source%20of%20Truth)%20913368daa73f4a2aab9b46b6587675cd/What%20is%20the%20retention%20policy%20for%20the%20audit%20trail%20f%20f5d56db3204542aeb7fa4f16b76604d0.md, %F0%9F%97%82%20V1%20Foundational%20Schema%20(Source%20of%20Truth)%20913368daa73f4a2aab9b46b6587675cd/Is%20this%20dataset%20legally%20required%20to%20have%20audit%20tra%20586dc3b050f24cda97a94cbe8ff74216.md",,
"Is there a data protection standard that this dataset complies with? If yes, which data protection standard?","What is the data protection standard, if any, that this dataset complies with?",This is a yes/no question to determine whether the dataset is protected by a formal standard. also requires a list of all recognized standards (if applicable).,Shreyasha Paudel,Governance > Data Compliance > Data Protection,Yes/No — short,Yes/No,,"%F0%9F%97%82%20V1%20Foundational%20Schema%20(Source%20of%20Truth)%20913368daa73f4a2aab9b46b6587675cd/How%20is%20compliance%20with%20the%20data%20protection%20standar%2058d1d2ba58a5447391a847f29d8cb75f.md, %F0%9F%97%82%20V1%20Foundational%20Schema%20(Source%20of%20Truth)%20913368daa73f4a2aab9b46b6587675cd/Is%20this%20dataset%20legally%20required%20to%20comply%20with%20da%20c452720a4ae948bda81cb693a7acaf6e.md, %F0%9F%97%82%20V1%20Foundational%20Schema%20(Source%20of%20Truth)%20913368daa73f4a2aab9b46b6587675cd/If%20yes,%20which%20data%20protection%20standard%20applies%20to%20%20a6baab62604e40c0a5bdcbfaa8dbef56.md",,
"Are there policies that govern protected information for this dataset? ","Are there policies that govern protected information for this dataset? ","This is a yes/no question to determine whether the dataset has policies that govern protected information. If yes, provide a description in the nested question",Shreyasha Paudel,Governance > Data Compliance > Data Protection,Yes/No — long,Yes/No,,"%F0%9F%97%82%20V1%20Foundational%20Schema%20(Source%20of%20Truth)%20913368daa73f4a2aab9b46b6587675cd/If%20yes,%20please%20describe%20the%20policies%20fad8f4ede1d64969bca17a75f738a59d.md",,
"If yes, please describe the policies.",What are the policies?,"A list and brief description of the policies that govern protected information for this dataset, if they are associated with a data protection level and/or any links available to the documentation",Riya Swayampati,Governance > Data Compliance > Data Protection,,Short Description (List),,,%F0%9F%97%82%20V1%20Foundational%20Schema%20(Source%20of%20Truth)%20913368daa73f4a2aab9b46b6587675cd/Are%20there%20policies%20that%20govern%20protected%20informati%20c3db7e6824ca446a8ddf029307fce800.md,
How is compliance with the data protection standard verified for this dataset ?,How is compliance with the data protection standard verified for this dataset ?,"A brief step-wise description for the process to verify compliance with data protection standard. ",Shreyasha Paudel,Governance > Data Compliance > Data Protection,Long Answer,Long Description,,,%F0%9F%97%82%20V1%20Foundational%20Schema%20(Source%20of%20Truth)%20913368daa73f4a2aab9b46b6587675cd/Is%20there%20a%20data%20protection%20standard%20that%20this%20data%204bfc1a999dc643e8a54d304ba35672f0.md,
"Is there a data protection officer assigned to the dataset? ","Is there a data protection officer assigned to the dataset? ","This is a yes/no question to identify if there is a data protection officer for the dataset. ",Shreyasha Paudel,Governance > Data Compliance > Data Protection,Yes/No — short,Yes/No,,"%F0%9F%97%82%20V1%20Foundational%20Schema%20(Source%20of%20Truth)%20913368daa73f4a2aab9b46b6587675cd/What%20are%20the%20roles%20and%20responsibilities%20of%20the%20dat%20d3436d2b3cb44b58a97deb005956e514.md, %F0%9F%97%82%20V1%20Foundational%20Schema%20(Source%20of%20Truth)%20913368daa73f4a2aab9b46b6587675cd/Who%20is%20the%20data%20protection%20officer%20assigned%20to%20the%20bcc79e5bdcbf4694bc143b2d2ebfaa5e.md",,
Who is the data protection officer assigned to the dataset?,Who is the data protection officer assigned to the dataset?,The name and contact information for the data protection officer assigned to the dataset.,"Riya Swayampati, Shreyasha Paudel",Governance > Data Compliance > Data Protection,,Person (List),,,%F0%9F%97%82%20V1%20Foundational%20Schema%20(Source%20of%20Truth)%20913368daa73f4a2aab9b46b6587675cd/Is%20there%20a%20data%20protection%20officer%20assigned%20to%20the%204c24ad892fc44b499d6b2f5dff7a8fbc.md,
What are the roles and responsibilities of the data protection officer?,What are the roles and responsibilities of the data protection officer?,,Shreyasha Paudel,Governance > Data Compliance > Data Protection,Long Answer,Short Description (List),,,%F0%9F%97%82%20V1%20Foundational%20Schema%20(Source%20of%20Truth)%20913368daa73f4a2aab9b46b6587675cd/Is%20there%20a%20data%20protection%20officer%20assigned%20to%20the%204c24ad892fc44b499d6b2f5dff7a8fbc.md,
Is there a policy for anonymizing sensitive information in dataset? Please explain.,"Is there a policy for anonymizing sensitive information in dataset? ","A yes/no question stating whether there is a standard organizational policy for anonymizing sensitive information. ",Shreyasha Paudel,Governance > Data Compliance > Data Protection,Yes/No — long,Yes/No,,%F0%9F%97%82%20V1%20Foundational%20Schema%20(Source%20of%20Truth)%20913368daa73f4a2aab9b46b6587675cd/Please%20describe%20the%20policy%20ca1a391f8dec449cad54f557bd07584f.md,,
Please describe the policy,"What is the policy for anonymizing sensitive information in dataset? ",A long description of all the policies for anonymizing sensitive information in the dataset. This description should include what information is identified as sensitive.,"Riya Swayampati, Shreyasha Paudel",Governance > Data Compliance > Data Protection,,Long Description,,,%F0%9F%97%82%20V1%20Foundational%20Schema%20(Source%20of%20Truth)%20913368daa73f4a2aab9b46b6587675cd/Is%20there%20a%20policy%20for%20anonymizing%20sensitive%20inform%20722c068213354c9e93ad182c180dc024.md,
Is this dataset legally required to comply with data protection standard?,Is this dataset legally required to comply with data protection standard?,"This is asking if there is a legal requirement (federal, state or local) law for a data protection standard.",Shreyasha Paudel,Governance > Data Compliance > Data Protection,Yes/No,Yes/No,,,%F0%9F%97%82%20V1%20Foundational%20Schema%20(Source%20of%20Truth)%20913368daa73f4a2aab9b46b6587675cd/Is%20there%20a%20data%20protection%20standard%20that%20this%20data%204bfc1a999dc643e8a54d304ba35672f0.md,
Who is responsible for identifying and protecting sensitive information in the dataset?,Who is responsible for identifying and protecting sensitive information in the dataset?,A person (or a list of people) who are responsible for identifying and protecting sensitive information at different stages of the data lifecycle.,Shreyasha Paudel,Governance > Decision-Makers > Org Roles,Short Answer,Person (List),,,,Principle for governance - Rights of people (data protection)
Is there a community liaison who acts as an interface between the community and the data project?,Is there a community liaison who acts as an interface between the community and the data project?,A yes/no question to identify if there is an identified role for interacting between the data project and the community.,Shreyasha Paudel,Governance > Decision-Makers > Org Roles,Yes/No,Yes/No,,"%F0%9F%97%82%20V1%20Foundational%20Schema%20(Source%20of%20Truth)%20913368daa73f4a2aab9b46b6587675cd/What%20are%20the%20responsibilities%20for%20the%20community%20li%20ad7f9ca1e27e455792d2fe0b6b404979.md, %F0%9F%97%82%20V1%20Foundational%20Schema%20(Source%20of%20Truth)%20913368daa73f4a2aab9b46b6587675cd/Who%20is%20the%20community%20liaison%203d34705f5fc44763b00ed6ab73aa9125.md",,Principle for governance - Accountable to community
Who is the community liaison?,Who is the community liaison?,"A person (or a list of people) who act as community liaisons at different stages of the data lifecycle. ","Riya Swayampati, Shreyasha Paudel",Governance > Decision-Makers > Org Roles,,Person (List),,,%F0%9F%97%82%20V1%20Foundational%20Schema%20(Source%20of%20Truth)%20913368daa73f4a2aab9b46b6587675cd/Is%20there%20a%20community%20liaison%20who%20acts%20as%20an%20interf%209cab5b7b4099421bbb1840125cff1d20.md,
What are the responsibilities for the community liaision?,What are the responsibilities for the community liaision?,A long description for all the tasks that community liaision/s would perform in their interactions with the community.,Shreyasha Paudel,Governance > Decision-Makers > Org Roles,Short Answer,Short Description (List),,,%F0%9F%97%82%20V1%20Foundational%20Schema%20(Source%20of%20Truth)%20913368daa73f4a2aab9b46b6587675cd/Is%20there%20a%20community%20liaison%20who%20acts%20as%20an%20interf%209cab5b7b4099421bbb1840125cff1d20.md,Principle for governance - Accountable to community
Who is responsible for determining if the data needs to be updated?,Who is responsible for determining if the data needs to be updated?,A person (or a list of people) who are responsible for determining if the data needs to be updated at different stages of data lifecycle.,Shreyasha Paudel,Governance > Decision-Makers > Org Roles,Short Answer,Person (List),,%F0%9F%97%82%20V1%20Foundational%20Schema%20(Source%20of%20Truth)%20913368daa73f4a2aab9b46b6587675cd/Who%20is%20responsible%20for%20updating%20the%20data%20c1efc81525ef4c24833ad4389c831709.md,,Principle for governance - Recency
Who is responsible for updating the data?,Who is responsible for updating the data?,A person (or a list of people) who are responsible for updating the data. This can be same or different role as determining if the data needs to be updated.,Shreyasha Paudel,Governance > Decision-Makers > Org Roles,Short Answer,Person (List),,,%F0%9F%97%82%20V1%20Foundational%20Schema%20(Source%20of%20Truth)%20913368daa73f4a2aab9b46b6587675cd/Who%20is%20responsible%20for%20determining%20if%20the%20data%20nee%202fb79b2894bf480ea7a85b3536820705.md,Principle for governance - Recency
Who is responsible for determining that the data is trustworthy?,Who is responsible for determining that the data is trustworthy?,"The name and organizational contact of the person (or a list of people) who are responsible for determining the trustworthiness of the dataset.  ",Shreyasha Paudel,Governance > Decision-Makers > Org Roles,Short Answer,Person (List),,,,Principle for governance - Trustworthiness
Who creates and documents consent forms?,Who creates and documents consent forms?,"A person (or a list of people) who create consent forms for data constituents. ",Shreyasha Paudel,Governance > Decision-Makers > Org Roles,Short Answer,Person (List),,,%F0%9F%97%82%20V1%20Foundational%20Schema%20(Source%20of%20Truth)%20913368daa73f4a2aab9b46b6587675cd/Is%20there%20an%20organizational%20role%20for%20creating%20and%20d%206f8191b71f5b4a55b2838afe723ae388.md,Principle for governance - Rights of people (consent)
"Who is responsible for maintaining data security? ","Who is responsible for maintaining data security? ","A person (or a list of people) who are responsible for maintaining data security. ",Shreyasha Paudel,Governance > Decision-Makers > Org Roles,Short Answer,Person (List),,,%F0%9F%97%82%20V1%20Foundational%20Schema%20(Source%20of%20Truth)%20913368daa73f4a2aab9b46b6587675cd/Is%20there%20an%20organizational%20role%20for%20maintaining%20da%20b5b202d535e542b49ec0779a91b81b60.md,
"Is there an organizational role for maintaining data security? ",Is there an organizational role for maintaining data security?,This is a yes/no question to determine if there is a defined role for data security. This could be an organization wide role or a team specific role.,Shreyasha Paudel,Governance > Decision-Makers > Org Roles,Yes/No — short,Yes/No,,"%F0%9F%97%82%20V1%20Foundational%20Schema%20(Source%20of%20Truth)%20913368daa73f4a2aab9b46b6587675cd/Who%20is%20responsible%20for%20maintaining%20data%20security%20384b38046279433790c3cd945504bb54.md, %F0%9F%97%82%20V1%20Foundational%20Schema%20(Source%20of%20Truth)%20913368daa73f4a2aab9b46b6587675cd/What%20are%20the%20responsibilities%20for%20maintaining%20data%20ba653f47be1b48e990d04902e676314a.md",,
What are the responsibilities for maintaining data security?,What are the responsibilities for the role associated with  maintaining data security?,A brief descriptions of all the tasks that are required for maintaining data security.,"Riya Swayampati, Shreyasha Paudel",Governance > Decision-Makers > Org Roles,,Short Description (List),,,%F0%9F%97%82%20V1%20Foundational%20Schema%20(Source%20of%20Truth)%20913368daa73f4a2aab9b46b6587675cd/Is%20there%20an%20organizational%20role%20for%20maintaining%20da%20b5b202d535e542b49ec0779a91b81b60.md,
"Is there an organizational role for creating and documenting consent forms? ","Is there an organizational role for creating and documenting consent forms? ",This is a yes/no question to determine if there is a defined role for creating and documenting consent forms. This could be an organization wide role or a team specific role.,Shreyasha Paudel,Governance > Decision-Makers > Org Roles,Yes/No — short,Yes/No,,"%F0%9F%97%82%20V1%20Foundational%20Schema%20(Source%20of%20Truth)%20913368daa73f4a2aab9b46b6587675cd/Who%20creates%20and%20documents%20consent%20forms%20c6d3112340364f8d95128cd0a5f1529f.md, %F0%9F%97%82%20V1%20Foundational%20Schema%20(Source%20of%20Truth)%20913368daa73f4a2aab9b46b6587675cd/Please%20describe%20the%20responsibilities%20associated%20wi%20e6f7dea4eb1746aa80de3fa48144869a.md",,
Please describe the responsibilities associated with this role.,What are the responsibilities for the role associated with creating and documenting consent forms?,A brief description of all the tasks that are required for creating and documenting consent forms including any review processes that might exist.,"Riya Swayampati, Shreyasha Paudel",Governance > Decision-Makers > Org Roles,,Short Description (List),,,%F0%9F%97%82%20V1%20Foundational%20Schema%20(Source%20of%20Truth)%20913368daa73f4a2aab9b46b6587675cd/Is%20there%20an%20organizational%20role%20for%20creating%20and%20d%206f8191b71f5b4a55b2838afe723ae388.md,
Was this data project reviewed by an Institutional Review Board ?,Was this data project reviewed by an Institutional Review Board ?,A yes/no question to identify whether the project was reviewed by and IRB Board.,Shreyasha Paudel,Governane > Data Compliance > IRB,Yes/No,Yes/No,,"%F0%9F%97%82%20V1%20Foundational%20Schema%20(Source%20of%20Truth)%20913368daa73f4a2aab9b46b6587675cd/Please%20list%20materials%20submitted%20for%20IRB%20review%2037ca007b93e741e3a74746b212bd7684.md, %F0%9F%97%82%20V1%20Foundational%20Schema%20(Source%20of%20Truth)%20913368daa73f4a2aab9b46b6587675cd/Did%20IRB%20require%20modifications%20to%20the%20initial%20propo%200feeb5f8d82d454abb940340f4a99fdd.md, %F0%9F%97%82%20V1%20Foundational%20Schema%20(Source%20of%20Truth)%20913368daa73f4a2aab9b46b6587675cd/Who%20has%20access%20to%20the%20IRB%20records%202d589720c3aa4e4b814678ff5239b079.md, %F0%9F%97%82%20V1%20Foundational%20Schema%20(Source%20of%20Truth)%20913368daa73f4a2aab9b46b6587675cd/Why%20did%20this%20project%20go%20through%20IRB%20process%20or%20not%20fc486ffd01864c76b36936217f414cd8.md",,
Please list materials submitted for IRB review.,"What materials were submitted for IRB review? ","A list and brief description of all the materials that were submitted for the IRB review. If documentation is shareable, they can be linked as a resource here. ",Shreyasha Paudel,Governane > Data Compliance > IRB,Long Answer,Resource (List),,,%F0%9F%97%82%20V1%20Foundational%20Schema%20(Source%20of%20Truth)%20913368daa73f4a2aab9b46b6587675cd/Was%20this%20data%20project%20reviewed%20by%20an%20Institutional%201688680b28854c47bb6a1b086e88b8c6.md,
Did IRB require modifications to the initial proposal? Please describe the modification.,Describe any modifications required by the iRB to the initial proposal,"A list and a brief descritption of any modifications to the initial proposal that resulted from the IRB process. If there were no modifications, please state so. ",Shreyasha Paudel,Governane > Data Compliance > IRB,Long Answer,Long Description,,,%F0%9F%97%82%20V1%20Foundational%20Schema%20(Source%20of%20Truth)%20913368daa73f4a2aab9b46b6587675cd/Was%20this%20data%20project%20reviewed%20by%20an%20Institutional%201688680b28854c47bb6a1b086e88b8c6.md,
Who has access to the IRB records?,Who has access to the IRB records?,"A list of people who can access IRB records. Ideally, the list should contain name and organizational roles.",Shreyasha Paudel,Governane > Data Compliance > IRB,Short Answer,Person (List),,,%F0%9F%97%82%20V1%20Foundational%20Schema%20(Source%20of%20Truth)%20913368daa73f4a2aab9b46b6587675cd/Was%20this%20data%20project%20reviewed%20by%20an%20Institutional%201688680b28854c47bb6a1b086e88b8c6.md,
Does this project have a legal requirement to be reviewed by and IRB?,Does this project have a legal requirement to be reviewed by and IRB?,This is a yes/no question asking for legal requirements to deal with IRB,Shreyasha Paudel,Governane > Data Compliance > IRB,Yes/No,Yes/No,,,,
What are the policies to deal with data that might not be trustworthy?,What are the policies to deal with data that might not be trustworthy?,A list and brief description of policies that are in place to deal with data that is identified as untrustworthy. It can list existing policy as a resource or describe in text. Please mention if there are no such documented policies.,Shreyasha Paudel,Governance> Data Compliance > Data Disclosure,Short Answer,Short Description (List),,,,Principle for governance - Trustworthiness
What are the items included in audit trail ?,What are the items included in audit trail ?,A list and a brief description of all the components of the dataset that is included in an audit trail.,"Shreyasha Paudel, Riya Swayampati",Governance > Data Compliance > Audit Trail,Short Answer,Short Description (List),,,%F0%9F%97%82%20V1%20Foundational%20Schema%20(Source%20of%20Truth)%20913368daa73f4a2aab9b46b6587675cd/Does%20the%20dataset%20have%20an%20audit%20trail%20or%20record%20of%20%200387f1ffe080414ea2af872f9456c5fa.md,
Please describe the logical and procedural controls for enabling the audit trail for the dataset.,What controls are used to enable the audit trail for the dataset?,A list and description of all the logical and procedural controls needed for the audit trail,"Shreyasha Paudel, Riya Swayampati",Governance > Data Compliance > Audit Trail,Long Answer,Short Description (List),,,%F0%9F%97%82%20V1%20Foundational%20Schema%20(Source%20of%20Truth)%20913368daa73f4a2aab9b46b6587675cd/Does%20the%20dataset%20have%20an%20audit%20trail%20or%20record%20of%20%200387f1ffe080414ea2af872f9456c5fa.md,
Please describe the policies available for reviewing the audit trail for the dataset.,What are the policies available for reviewing the audit trail for the dataset?,A brief description of the policies in place for reviewing the audit trail,"Shreyasha Paudel, Riya Swayampati",Governance > Data Compliance > Audit Trail,Long Answer,Short Description (List),,,%F0%9F%97%82%20V1%20Foundational%20Schema%20(Source%20of%20Truth)%20913368daa73f4a2aab9b46b6587675cd/Does%20the%20dataset%20have%20an%20audit%20trail%20or%20record%20of%20%200387f1ffe080414ea2af872f9456c5fa.md,
What is the retention policy for the audit trail for the dataset?,What is the retention policy for the audit trail for the dataset?,A description of the retention policy regarding the audit trail for the dataset,"Shreyasha Paudel, Riya Swayampati",Governance > Data Compliance > Audit Trail,Long Answer,Long Description,,,%F0%9F%97%82%20V1%20Foundational%20Schema%20(Source%20of%20Truth)%20913368daa73f4a2aab9b46b6587675cd/Does%20the%20dataset%20have%20an%20audit%20trail%20or%20record%20of%20%200387f1ffe080414ea2af872f9456c5fa.md,
