Question (deprecated),Question (summary),Question (description - optional),Contributors,Context layer,Question Type (deprecated),Question Type,Resource Type(s),Nested Questions,Parent Question,Notes
Is this dataset legally required to have audit trails?,Is this dataset legally required to have audit trails?,"A yes/no question asking whether the dataset is required to have audit trails ","Shreyasha Paudel, Riya Swayampati",Governance > Data Compliance > Audit Trail,Yes/No,Yes/No,,,%F0%9F%97%82%20V1%20Foundational%20Schema%20(Source%20of%20Truth)%20913368daa73f4a2aab9b46b6587675cd/Does%20the%20dataset%20have%20an%20audit%20trail%20or%20record%20of%20%200387f1ffe080414ea2af872f9456c5fa.md,
Are there data disclosure documents for sharing and dissemination of this dataset?,Are there data disclosure documents for sharing and dissemination of this dataset?,A list of data disclosure documents related to the dataset and a brief description or link to the document for each one,"Shreyasha Paudel, Riya Swayampati",Governance > Data Disclosure,Yes/No — long,Resource (List),,%F0%9F%97%82%20V1%20Foundational%20Schema%20(Source%20of%20Truth)%20913368daa73f4a2aab9b46b6587675cd/Untitled%206549e55237f04c64b2731f06ceb2572d.md,,
"Who can access this dataset? ","Who can access this dataset? ",A list of people or entities who can access the dataset,"Shreyasha Paudel, Riya Swayampati",Governance > Access,Short Answer,Person (List),,,,
Can the public access the dataset online or download the dataset?,Can the public access the dataset online or download the dataset?,"This asks whether the general public can access/ download the dataset. There might be some specific limitations (for example: only people within certain geographic region) to who can access this dataset in the community and that should be mentioned here. ","Shreyasha Paudel, Riya Swayampati",Governance > Access,Yes/No — short,Short Description,,%F0%9F%97%82%20V1%20Foundational%20Schema%20(Source%20of%20Truth)%20913368daa73f4a2aab9b46b6587675cd/Is%20it%20possible%20to%20track%20who%20accessed%20or%20downloaded%20463a480ed5fb42c1b15b623d8589af68.md,,
"Is it possible to track who accessed or downloaded the dataset? ","Is it possible to track who accessed or downloaded the dataset? ",A yes/no question about the traceability of the dataset- can we track who accessed or downloaded the data in the public?,"Shreyasha Paudel, Riya Swayampati",Governance > Access,Yes/No — short,Yes/No,,%F0%9F%97%82%20V1%20Foundational%20Schema%20(Source%20of%20Truth)%20913368daa73f4a2aab9b46b6587675cd/Please%20describe%20how%2034668520dac64779aef63cd639d58629.md,%F0%9F%97%82%20V1%20Foundational%20Schema%20(Source%20of%20Truth)%20913368daa73f4a2aab9b46b6587675cd/Can%20the%20public%20access%20the%20dataset%20online%20or%20downlo%20d5351983ddff48cf9c68fd356467397e.md,
"Please describe how. ",What is the process used to track who accessed or downloaded the dataset?,"A long description of the process of tracking access and downloads for the dataset ",Riya Swayampati,Governance > Access,,Long Description,,,%F0%9F%97%82%20V1%20Foundational%20Schema%20(Source%20of%20Truth)%20913368daa73f4a2aab9b46b6587675cd/Is%20it%20possible%20to%20track%20who%20accessed%20or%20downloaded%20463a480ed5fb42c1b15b623d8589af68.md,
Please describe the process for giving access to the dataset to a new user.,What is the process for giving access to a new user?,A detailed description of the process of giving access to a new user,"Shreyasha Paudel, Riya Swayampati",Governance > Access,Long Answer,Long Description,,,,
"Please describe the policy or process, if any,  to determine if access to the dataset should be revoked.","Is there a policy or process to determine if access should be revoked? What is it? ","This is a question asking if there is a policy or process regarding revoking access to data and then asking for a description ","Shreyasha Paudel, Riya Swayampati",Governance > Access,Long Answer,Long Description,,,,
"Is the dataset and results shared with people outside the organization? If yes, please describe how.","Is the dataset and results shared with people outside the organization? How? ",This requires a description of process for sharing dataset and results outside of the organization (if applicable),"Shreyasha Paudel, Riya Swayampati",Governance > Access,Yes/No — short,Short Description,,,,
Is there a policy to determine if the data needs to be updated? Please describe.,What is the policy regarding data updates?,A brief description of the process or policy determining whether data needs to be updated. It should detail when this policy comes into effect and if there are any special cases when it doesn't (if applicable),"Shreyasha Paudel, Riya Swayampati",Governance > Data Use,Yes/No — short,Short Description,,,,
Are there any documented restrictions/limitations on the usage of this dataset?,What are the documented restrictions/limitations on the usage of this dataset?,A list of any documented restrictions/limitations on the usage of the dataset along with a brief description,"Shreyasha Paudel, Riya Swayampati",Governance > Data Use,Yes/No — long,Short Description (List),,,,
"Why did this project go through IRB process or not go through IRB process? ","Why did this project go through IRB process or not go through IRB process? ","This is a follow-up question asking why the data project needed to go through IRB, or why it was determined that a review was not necessary. ",Shreyasha Paudel,Governane > Data Compliance > IRB,Short Answer,Short Description,,,%F0%9F%97%82%20V1%20Foundational%20Schema%20(Source%20of%20Truth)%20913368daa73f4a2aab9b46b6587675cd/Was%20this%20data%20project%20reviewed%20by%20an%20Institutional%201688680b28854c47bb6a1b086e88b8c6.md,
,What happens if a security breach is detected for this dataset?,Describe step-wise process that occurs when a security breach is detected for this dataset.,Shreyasha Paudel,Governance > Data Compliance > Security Protocols,Short Answer,Short Description (List),,,,
,Who has access to the data disclosure documents for sharing and dissemination of this dataset?,This is asking for a list of people or groups who may access the data disclosure documents that exist.,Shreyasha Paudel,Governance > Data Disclosure,,Person (List),,,%F0%9F%97%82%20V1%20Foundational%20Schema%20(Source%20of%20Truth)%20913368daa73f4a2aab9b46b6587675cd/Are%20there%20data%20disclosure%20documents%20for%20sharing%20an%20226408b5964f4a01aba7a3be6fd6d8be.md,
Is there any information about the motivation for this dataset?,,,,,,,,,%F0%9F%97%82%20V1%20Foundational%20Schema%20(Source%20of%20Truth)%20913368daa73f4a2aab9b46b6587675cd/Is%20there%20a%20stated%20or%20documented%20purpose%20for%20this%20d%20574c038a2c1e4a6996dc66669b564096.md,
,How?,"A description of how humans have examined the dataset, analysis, or models - for example, through manual error analysis - in order to understand generalizations present in the data. Document any artifacts that may be present in the dataset.",Katy McKinney-Bock,,,Short Description,,,%F0%9F%97%82%20V1%20Foundational%20Schema%20(Source%20of%20Truth)%20913368daa73f4a2aab9b46b6587675cd/Have%20humans%20examined%20any%20analysis%20or%20models%20(e%20g%20w%206fa38beeeddb43f2a4807fadf8935623.md,
,What is the relationship between human subjects (or annotators) and models?,"A description of the relationship between human subjects, or annotators, and machine learning models throughout the Data Lifecycle, as applicable.",Katy McKinney-Bock,,,Short Description,,,%F0%9F%97%82%20V1%20Foundational%20Schema%20(Source%20of%20Truth)%20913368daa73f4a2aab9b46b6587675cd/Did%20people%20collect%20and%20or%20annotate%20the%20data%20in%20ord%2010bcda9086994b2e8c01853ae124985e.md,
,Is there a diagram showing information flow between humans and automated systems?,"A diagram (such as a data lineage diagram) showing information flow, noting where humans and automated systems are present and interact.",Katy McKinney-Bock,,,Resource,Image,,%F0%9F%97%82%20V1%20Foundational%20Schema%20(Source%20of%20Truth)%20913368daa73f4a2aab9b46b6587675cd/Include%20a%20diagram%20showing%20information%20flow%20between%20cf17b3f20d6f41339d2ca45002afc032.md,
,How?,"A description of how machine learning is used during any steps of the data lifecycle, including during analysis or downstream application.",Katy McKinney-Bock,Humans/Machines in the Loop > Automated Processes,,Short Description,,,%F0%9F%97%82%20V1%20Foundational%20Schema%20(Source%20of%20Truth)%20913368daa73f4a2aab9b46b6587675cd/Is%20machine%20learning%20used%20during%20any%20steps%20of%20the%20d%20c66ef02b54e04a08a66cad6cac0c486e.md,
,How?,A description of how machine learning is used in downstream applications.,Katy McKinney-Bock,Humans/Machines in the Loop > Automated Processes,,Short Description,,,%F0%9F%97%82%20V1%20Foundational%20Schema%20(Source%20of%20Truth)%20913368daa73f4a2aab9b46b6587675cd/Is%20machine%20learning%20used%20in%20any%20downstream%20applica%202a61f87c81534173b21e83a19966bc5f.md,
,How?,"A description of how algorithms continue to learn or change during, in cases where data collection is continuous or ongoing.",Katy McKinney-Bock,Humans/Machines in the Loop > Automated Processes,,Short Description,,,"%F0%9F%97%82%20V1%20Foundational%20Schema%20(Source%20of%20Truth)%20913368daa73f4a2aab9b46b6587675cd/If%20the%20dataset%20is%20continuously%20collected%20updated,%20%201a81a9e0c36e40119ef97a7a8fcede01.md",
How is the dataset labeled or annotated?,How is the dataset labeled or annotated?,This describes if the dataset has any existing labels or annotations resulting from the data collection process.,Katie Morrice,Methodology Cycle > Data Collection,,Short Description,,,%F0%9F%97%82%20V1%20Foundational%20Schema%20(Source%20of%20Truth)%20913368daa73f4a2aab9b46b6587675cd/Is%20the%20dataset%20labeled%20or%20annotated%20Describe%20d724779693b24633866a8c39456ad102.md,
,"What omissions were found, and what corrections were made?","A description of any omissions that were made in the dataset at any point in the data lifecycle, and whether the omission was corrected, including details of steps taken.",Katy McKinney-Bock,Data Preservation > Corrections,,Short Description (List),,,"%F0%9F%97%82%20V1%20Foundational%20Schema%20(Source%20of%20Truth)%20913368daa73f4a2aab9b46b6587675cd/Document%20any%20errors,%20corrections,%20and%20omissions%20ma%20305215bad6b741c990b8644b8b20a00d.md",
,Were there other corrections made to the dataset?,A description of steps taken to make any other corrections to the dataset during the data lifecycle.,Katy McKinney-Bock,Data Preservation > Corrections,,Short Description (List),,,"%F0%9F%97%82%20V1%20Foundational%20Schema%20(Source%20of%20Truth)%20913368daa73f4a2aab9b46b6587675cd/Document%20any%20errors,%20corrections,%20and%20omissions%20ma%20305215bad6b741c990b8644b8b20a00d.md",
,"What information is missing that would be needed to replicate the data lifecycle? ","A description of information that is missing or not available, and that would be necessary for replicating the data lifecycle.",Katy McKinney-Bock,Humans/Machines in the Loop > Reproducibility Requirements,,Short Description (List),,,%F0%9F%97%82%20V1%20Foundational%20Schema%20(Source%20of%20Truth)%20913368daa73f4a2aab9b46b6587675cd/What%20are%20the%20necessary%20conditions%20for%20replicating%20%201ec70f68b7634b4aa7bdca1fcdcc8004.md,"This may be transformational, but I'm certain there are some ways to identify what is missing from foundational information → then take it into transformational discussion about why this is problematic. "